{
  "version": 1,
  "source": {
    "name": "NIST Special Publication 811 (2008), Appendix B.9",
    "document": "standards/raw/nistspecialpublication811e2008.pdf",
    "appendix": "B.9",
    "pages": "57-69"
  },
  "appendix_relationship": {
    "b8": "Appendix B.8 lists the same units alphabetically.",
    "b9": "Appendix B.9 lists the same units alphabetically within kinds of quantities and fields of science.",
    "selected_source": "B.9"
  },
  "categories": [
    {
      "name": "ACCELERATION",
      "slug": "acceleration",
      "conversions": [
        {
          "from": "acceleration of free fall, standard (gn)",
          "to": "meter per second squared (m / s2)",
          "rule": "9.80665E+00",
          "rule_type": "factor",
          "display_label": "acceleration of free fall, standard (gn) -> meter per second squared (m / s2)",
          "source_appendix": "B.9",
          "source_page": 69
        },
        {
          "from": "foot per second squared (ft / s2)",
          "to": "meter per second squared (m / s2)",
          "rule": "3.048E-01",
          "rule_type": "factor",
          "display_label": "foot per second squared (ft / s2) -> meter per second squared (m / s2)",
          "source_appendix": "B.9",
          "source_page": 69
        },
        {
          "from": "gal (Gal)",
          "to": "meter per second squared (m / s2)",
          "rule": "1.0E-02",
          "rule_type": "factor",
          "display_label": "gal (Gal) -> meter per second squared (m / s2)",
          "source_appendix": "B.9",
          "source_page": 69
        },
        {
          "from": "inch per second squared (in / s2)",
          "to": "meter per second squared (m / s2)",
          "rule": "2.54E-02",
          "rule_type": "factor",
          "display_label": "inch per second squared (in / s2) -> meter per second squared (m / s2)",
          "source_appendix": "B.9",
          "source_page": 69
        }
      ]
    },
    {
      "name": "ANGLE",
      "slug": "angle",
      "conversions": [
        {
          "from": "degree (°)",
          "to": "radian (rad)",
          "rule": "1.745329E-02",
          "rule_type": "factor",
          "display_label": "degree (°) -> radian (rad)",
          "source_appendix": "B.9",
          "source_page": 69
        },
        {
          "from": "gon (also called grade) (gon)",
          "to": "radian (rad)",
          "rule": "1.570796E-02",
          "rule_type": "factor",
          "display_label": "gon (also called grade) (gon) -> radian (rad)",
          "source_appendix": "B.9",
          "source_page": 69
        },
        {
          "from": "gon (also called grade) (gon)",
          "to": "degree (°)",
          "rule": "9.0E-01",
          "rule_type": "factor",
          "display_label": "gon (also called grade) (gon) -> degree (°)",
          "source_appendix": "B.9",
          "source_page": 69
        },
        {
          "from": "mil",
          "to": "radian (rad)",
          "rule": "9.817477E-04",
          "rule_type": "factor",
          "display_label": "mil -> radian (rad)",
          "source_appendix": "B.9",
          "source_page": 69
        },
        {
          "from": "mil",
          "to": "degree (°)",
          "rule": "5.625E-02",
          "rule_type": "factor",
          "display_label": "mil -> degree (°)",
          "source_appendix": "B.9",
          "source_page": 69
        },
        {
          "from": "minute (')",
          "to": "radian (rad)",
          "rule": "2.908882E-04",
          "rule_type": "factor",
          "display_label": "minute (') -> radian (rad)",
          "source_appendix": "B.9",
          "source_page": 69
        },
        {
          "from": "revolution (r)",
          "to": "radian (rad)",
          "rule": "6.283185E+00",
          "rule_type": "factor",
          "display_label": "revolution (r) -> radian (rad)",
          "source_appendix": "B.9",
          "source_page": 69
        },
        {
          "from": "second (\")",
          "to": "radian (rad)",
          "rule": "4.848137E-06",
          "rule_type": "factor",
          "display_label": "second (\") -> radian (rad)",
          "source_appendix": "B.9",
          "source_page": 69
        }
      ]
    },
    {
      "name": "AREA AND SECOND MOMENT OF AREA",
      "slug": "area-and-second-moment-of-area",
      "conversions": [
        {
          "from": "acre (based on U.S. survey foot)",
          "to": "square meter (m2)",
          "rule": "4.046873E+03",
          "rule_type": "factor",
          "display_label": "acre (based on U.S. survey foot) -> square meter (m2)",
          "source_appendix": "B.9",
          "source_page": 69
        },
        {
          "from": "are (a)",
          "to": "square meter (m2)",
          "rule": "1.0E+02",
          "rule_type": "factor",
          "display_label": "are (a) -> square meter (m2)",
          "source_appendix": "B.9",
          "source_page": 69
        },
        {
          "from": "barn (b)",
          "to": "square meter (m2)",
          "rule": "1.0E-28",
          "rule_type": "factor",
          "display_label": "barn (b) -> square meter (m2)",
          "source_appendix": "B.9",
          "source_page": 69
        },
        {
          "from": "circular mil",
          "to": "square meter (m2)",
          "rule": "5.067075E-10",
          "rule_type": "factor",
          "display_label": "circular mil -> square meter (m2)",
          "source_appendix": "B.9",
          "source_page": 69
        },
        {
          "from": "circular mil",
          "to": "square millimeter (mm2)",
          "rule": "5.067075E-04",
          "rule_type": "factor",
          "display_label": "circular mil -> square millimeter (mm2)",
          "source_appendix": "B.9",
          "source_page": 69
        },
        {
          "from": "foot to the fourth power (ft4)",
          "to": "meter to the fourth power (m4)",
          "rule": "8.630975E-03",
          "rule_type": "factor",
          "display_label": "foot to the fourth power (ft4) -> meter to the fourth power (m4)",
          "source_appendix": "B.9",
          "source_page": 69
        },
        {
          "from": "hectare (ha)",
          "to": "square meter (m2)",
          "rule": "1.0E+04",
          "rule_type": "factor",
          "display_label": "hectare (ha) -> square meter (m2)",
          "source_appendix": "B.9",
          "source_page": 69
        },
        {
          "from": "inch to the fourth power (in4)",
          "to": "meter to the fourth power (m4)",
          "rule": "4.162314E-07",
          "rule_type": "factor",
          "display_label": "inch to the fourth power (in4) -> meter to the fourth power (m4)",
          "source_appendix": "B.9",
          "source_page": 69
        },
        {
          "from": "square foot (ft2)",
          "to": "square meter (m2)",
          "rule": "9.290304E-02",
          "rule_type": "factor",
          "display_label": "square foot (ft2) -> square meter (m2)",
          "source_appendix": "B.9",
          "source_page": 69
        },
        {
          "from": "square inch (in2)",
          "to": "square meter (m2)",
          "rule": "6.4516E-04",
          "rule_type": "factor",
          "display_label": "square inch (in2) -> square meter (m2)",
          "source_appendix": "B.9",
          "source_page": 69
        },
        {
          "from": "square inch (in2)",
          "to": "square centimeter (cm2)",
          "rule": "6.4516E+00",
          "rule_type": "factor",
          "display_label": "square inch (in2) -> square centimeter (cm2)",
          "source_appendix": "B.9",
          "source_page": 69
        },
        {
          "from": "square mile (mi2)",
          "to": "square meter (m2)",
          "rule": "2.589988E+06",
          "rule_type": "factor",
          "display_label": "square mile (mi2) -> square meter (m2)",
          "source_appendix": "B.9",
          "source_page": 69
        },
        {
          "from": "square mile (mi2)",
          "to": "square kilometer (km2)",
          "rule": "2.589988E+00",
          "rule_type": "factor",
          "display_label": "square mile (mi2) -> square kilometer (km2)",
          "source_appendix": "B.9",
          "source_page": 69
        },
        {
          "from": "square mile (based on U.S. survey foot) (mi2)",
          "to": "square meter (m2)",
          "rule": "2.589998E+06",
          "rule_type": "factor",
          "display_label": "square mile (based on U.S. survey foot) (mi2) -> square meter (m2)",
          "source_appendix": "B.9",
          "source_page": 69
        },
        {
          "from": "square mile (based on U.S. survey foot) (mi2)",
          "to": "square kilometer (km2)",
          "rule": "2.589998E+00",
          "rule_type": "factor",
          "display_label": "square mile (based on U.S. survey foot) (mi2) -> square kilometer (km2)",
          "source_appendix": "B.9",
          "source_page": 69
        },
        {
          "from": "square yard (yd2)",
          "to": "square meter (m2)",
          "rule": "8.361274E-01",
          "rule_type": "factor",
          "display_label": "square yard (yd2) -> square meter (m2)",
          "source_appendix": "B.9",
          "source_page": 69
        }
      ]
    },
    {
      "name": "ELECTRICITY and MAGNETISM",
      "slug": "electricity-and-magnetism",
      "conversions": [
        {
          "from": "abampere",
          "to": "ampere (A)",
          "rule": "1.0E+01",
          "rule_type": "factor",
          "display_label": "abampere -> ampere (A)",
          "source_appendix": "B.9",
          "source_page": 69
        },
        {
          "from": "abcoulomb",
          "to": "coulomb (C)",
          "rule": "1.0E+01",
          "rule_type": "factor",
          "display_label": "abcoulomb -> coulomb (C)",
          "source_appendix": "B.9",